<?xml version="1.0" encoding="UTF-8"?>

<Lista xmlns:xsi="http://www.w3.org/2001/XMLSchema-instance"
 xsi:noNamespaceSchemaLocation="PaiNatal.xsd">
    <agendamento>
        <nr_elementos_familia>3</nr_elementos_familia>
        <cidade>cidade</cidade>
        <data>
            <dia>12</dia>
            <mes>11</mes>
            <ano>2021</ano>
        </data>
        <horas>
            <hora>13</hora>
            <minuto>00</minuto>
        </horas>
        <membros>
            <membro>
                <nome>Pai</nome>
                <nascimento>
                    <dia>1</dia>
                    <mes>1</mes>
                    <ano>1990</ano>
                </nascimento>
            </membro>
            <membro>
                <nome>Mae</nome>
                <nascimento>
                    <dia>1</dia>
                    <mes>2</mes>
                    <ano>1990</ano>
                </nascimento>
            </membro>
            <membro>
                <nome>Filho</nome>
                <nascimento>
                    <dia>1</dia>
                    <mes>2</mes>
                    <ano>1990</ano>
                </nascimento>
            </membro>
        </membros>
    </agendamento>

    <agendamento>
        <nr_elementos_familia>3</nr_elementos_familia>
        <cidade>cidade</cidade>
        <data>
            <dia>12</dia>
            <mes>11</mes>
            <ano>2021</ano>
        </data>
        <horas>
            <hora>13</hora>
            <minuto>00</minuto>
        </horas>
        <membros>
            <membro>
                <nome>Pai</nome>
                <nascimento>
                    <dia>1</dia>
                    <mes>1</mes>
                    <ano>1990</ano>
                </nascimento>
            </membro>
            <membro>
                <nome>Mae</nome>
                <nascimento>
                    <dia>1</dia>
                    <mes>2</mes>
                    <ano>1990</ano>
                </nascimento>
            </membro>
            <membro>
                <nome>Filho</nome>
                <nascimento>
                    <dia>1</dia>
                    <mes>2</mes>
                    <ano>1990</ano>
                </nascimento>
            </membro>
        </membros>
    </agendamento>

</Lista>